Title;EID;DOI;DocumentType;Year;Category
Ensemble deep learning for cervix image selection toward improving reliability in automated cervical precancer screening;2-s2.0-85088267988;10.3390/diagnostics10070451;Article;2020;anatomy
Deep learning-based image evaluation for cervical precancer screening with a smartphone targeting low resource settings - Engineering approach;2-s2.0-85089968637;10.1109/EMBC44109.2020.9175863;Conference Paper;2020;anatomy
Screening test accuracy to improve detection of precancerous lesions of the cervix in women living with HIV: A study protocol;2-s2.0-85098229521;10.1136/bmjopen-2020-037955;Article;2020;anatomy
Standalone performance of artificial intelligence for upper GI neoplasia: A meta-analysis;2-s2.0-85095743648;10.1136/gutjnl-2020-321922;Article;2021;anatomy
Is it real or not? Toward artificial intelligence-based realistic synthetic cytology image generation to augment teaching and quality assurance in pathology;2-s2.0-85125623905;10.1016/j.jasc.2022.02.001;Article;2022;anatomy
Risk stratification of cervical lesions using capture sequencing and machine learning method based on HPV and human integrated genomic profiles;2-s2.0-85073582629;10.1093/carcin/bgz094;Article;2019;anatomy
