Title;EID;DOI;DocumentType;Year;Category
A novel hybrid machine learning classification for the detection of bruxism patients using physiological signals;2-s2.0-85094600641;10.3390/app10217410;Article;2020;sleep medicine
Mobile and wearable sensors for data-driven health monitoring system: State-of-the-art and future prospect;2-s2.0-85129976791;10.1016/j.eswa.2022.117362;Review;2022;sleep medicine
Hierarchical Multi-agent System for Sleep Stages Classification;2-s2.0-85131957811;10.1142/S0218213022500026;Article;2022;sleep medicine
A Convolutional Neural Network for Artifacts Detection in EEG Data;2-s2.0-85129313239;10.1007/978-981-16-7618-5_1;Conference Paper;2022;sleep medicine
Machine learning-based automatic sleep apnoea and severity level classification using ECG and SpO2 signals;2-s2.0-85123396892;10.1080/03091902.2022.2026503;Article;2022;sleep medicine
